{
	"googleMsgID": "sample string",
	"ContextInformation": {
		"Messages": {
		},
		"Organization": "sample string",
		"UserId": "sample string",
		"UserLocale": "sample string",
		"Location": "sample string"
	},
	"CurrentPage": 11,
	"ExportDocuments": [
		{
			"Messages": {
			},
			"PIXSpecification": "sample string",
			"Description": "sample string",
			"SourceTransactionType": "sample string",
			"SourceEventName": "John Doe",
			"PIXFields": {
				"AsnId": "sample string",
				"Asn": "sample string",
				"InventoryAdjustmentType": "sample string"
			},
			"ItemDefinition": {
				"ItemId": "sample string"
			},
			"TransactionNumber": "sample string",
			"SequenceNumber": 11,
			"TransactionDateTime": "sample string",
			"Organization": "sample string",
			"Facility": "sample string"
		},
		{
			"Messages": {
			},
			"PIXSpecification": "sample string",
			"Description": "sample string",
			"SourceTransactionType": "sample string",
			"SourceEventName": "John Doe",
			"PIXFields": {
				"AsnId": "sample string",
				"Asn": "sample string",
				"InventoryAdjustmentType": "sample string"
			},
			"ItemDefinition": {
				"ItemId": "sample string"
			},
			"TransactionNumber": "sample string",
			"SequenceNumber": 11,
			"TransactionDateTime": "sample string",
			"Organization": "sample string",
			"Facility": "sample string"
		}
	],
	"UniqueJobId": "sample string",
	"TotalPages": 11
}
